{
  "$schema": "https://json-schema.org/draft/2020-12/schema",
  "title": "observed_fx_sample v0.4 data shape",
  "description": "Starter data shape, plus semantic checks in tools/validate_data.py. Not a complete game engine command contract.",
  "type": "object",
  "required": [
    "$schema",
    "auto_load_as_operating_data",
    "data_basis",
    "derivation",
    "items",
    "notes",
    "numeric_encoding",
    "purpose",
    "raw_hash_scope",
    "raw_sha256",
    "retrieved_on",
    "reuse",
    "schema_version",
    "scope",
    "source_description_url",
    "source_member",
    "source_member_sha256",
    "source_refs",
    "source_url",
    "unit"
  ],
  "properties": {
    "$schema": {
      "type": "string"
    },
    "auto_load_as_operating_data": {
      "type": "boolean"
    },
    "data_basis": {
      "type": "string"
    },
    "derivation": {
      "type": "object",
      "required": [
        "decimal_places",
        "formula",
        "rounding"
      ],
      "properties": {
        "decimal_places": {
          "type": "integer"
        },
        "formula": {
          "type": "string"
        },
        "rounding": {
          "type": "string"
        }
      },
      "additionalProperties": true
    },
    "items": {
      "type": "array",
      "items": {
        "type": "object",
        "required": [
          "date",
          "id",
          "krw_per_eur",
          "krw_per_usd_derived",
          "usd_per_eur"
        ],
        "properties": {
          "date": {
            "type": "string"
          },
          "id": {
            "type": "string"
          },
          "krw_per_eur": {
            "type": "string"
          },
          "krw_per_usd_derived": {
            "type": "string"
          },
          "usd_per_eur": {
            "type": "string"
          }
        },
        "additionalProperties": true
      }
    },
    "notes": {
      "type": "array",
      "items": {
        "type": "string"
      }
    },
    "numeric_encoding": {
      "type": "string"
    },
    "purpose": {
      "type": "string"
    },
    "raw_hash_scope": {
      "type": "string"
    },
    "raw_sha256": {
      "type": "string"
    },
    "retrieved_on": {
      "type": "string"
    },
    "reuse": {
      "type": "object",
      "required": [
        "access_notice_ko",
        "checked_on",
        "commercial_redistribution_note_ko",
        "modification_notice_ko",
        "source",
        "terms_url"
      ],
      "properties": {
        "access_notice_ko": {
          "type": "string"
        },
        "checked_on": {
          "type": "string"
        },
        "commercial_redistribution_note_ko": {
          "type": "string"
        },
        "modification_notice_ko": {
          "type": "string"
        },
        "source": {
          "type": "string"
        },
        "terms_url": {
          "type": "string"
        }
      },
      "additionalProperties": true
    },
    "schema_version": {
      "type": "string"
    },
    "scope": {
      "type": "object",
      "required": [
        "base_currency",
        "date_end",
        "date_start",
        "derived_fields",
        "frequency",
        "observations",
        "observed_fields",
        "publisher",
        "series"
      ],
      "properties": {
        "base_currency": {
          "type": "string"
        },
        "date_end": {
          "type": "string"
        },
        "date_start": {
          "type": "string"
        },
        "derived_fields": {
          "type": "array",
          "items": {
            "type": "string"
          }
        },
        "frequency": {
          "type": "string"
        },
        "observations": {
          "type": "integer"
        },
        "observed_fields": {
          "type": "array",
          "items": {
            "type": "string"
          }
        },
        "publisher": {
          "type": "string"
        },
        "series": {
          "type": "string"
        }
      },
      "additionalProperties": true
    },
    "source_description_url": {
      "type": "string"
    },
    "source_member": {
      "type": "string"
    },
    "source_member_sha256": {
      "type": "string"
    },
    "source_refs": {
      "type": "array",
      "items": {
        "type": "string"
      }
    },
    "source_url": {
      "type": "string"
    },
    "unit": {
      "type": "object",
      "required": [
        "krw_per_eur",
        "krw_per_usd_derived",
        "usd_per_eur"
      ],
      "properties": {
        "krw_per_eur": {
          "type": "string"
        },
        "krw_per_usd_derived": {
          "type": "string"
        },
        "usd_per_eur": {
          "type": "string"
        }
      },
      "additionalProperties": true
    }
  },
  "additionalProperties": true
}
